{"schema_version": "gms.skill-artifact.v2", "kind": "human_procedure", "title": "Requires unknown extension", "description": "Unknown required extension fails closed", "applicability": {"predicates": [], "exclusions": []}, "permissions": [{"capability": "memory_expand", "scope": "room-shared-space"}], "body": {"steps": [{"step_id": "s1-freeze", "instruction": "Freeze fixture set refs and baseline mapping", "preconditions": [{"field": "candidate.stage", "op": "equals", "value": "replay_pending"}], "postconditions": [{"field": "replay.packet", "op": "equals", "value": "frozen"}], "failure_action": "stop"}, {"step_id": "s2-replay", "instruction": "Execute paired causal replay via the deterministic adapter", "preconditions": [{"field": "replay.packet", "op": "equals", "value": "frozen"}], "postconditions": [{"field": "replay.result", "op": "equals", "value": "recorded"}], "failure_action": "mark_inconclusive"}]}, "extensions": {"ai.example.unregistered-required": {"required": true, "value": {"policy": "unknown"}}}}
