{"schema_version": "gms.skill-artifact.v2", "kind": "composite", "title": "Plan then report", "description": "Two-child DAG composite", "applicability": {"predicates": [], "exclusions": []}, "permissions": [{"capability": "skill_get", "scope": "pi-session"}], "body": {"children": [{"child_id": "c1-plan", "skill_ref": {"schema_version": "gms.skill-artifact-ref.v2", "lineage_id": "sg-alpha", "version": 2, "kind": "step_guidance", "artifact_digest": "sha256:f0a312792f18a320fcd20e05ae9728d26979c08c10e5b872e6120946cfd55823"}, "input_port": "request", "output_port": "plan"}, {"child_id": "c2-report", "skill_ref": {"schema_version": "gms.skill-artifact-ref.v2", "lineage_id": "sg-beta", "version": 1, "kind": "step_guidance", "artifact_digest": "sha256:d885c42ee6d6f72fdfa50ed1be68b9f1b562b50d1dfb5a1d5e880494af9a396f"}, "input_port": "plan", "output_port": "report"}], "edges": [{"from_child_id": "c1-plan", "from_port": "plan", "to_child_id": "c2-report", "to_port": "plan", "mapping": {}}], "retry_policies": [{"child_id": "c2-report", "max_attempts": 2, "retryable_reason_codes": ["EVIDENCE_NOT_COMMITTED"], "backoff_units": 1}], "failure_handlers": [{"child_id": "c2-report", "reason_codes": ["PORT_SCHEMA_MISSING"], "action": "fallback", "fallback_child_id": "c1-plan"}], "orchestration_permissions": [{"capability": "skill_get", "scope": "pi-session"}], "input_port_schema": {"schema_id": "schema.composite-input.v1", "version": 1, "digest": "sha256:10d9465d9e0560018830ed5b974963aa996524880974dcf03a4cdf073ec7b4f9"}, "output_port_schema": {"schema_id": "schema.composite-output.v1", "version": 1, "digest": "sha256:7f3d0bdb3103fc34de8a89a24e943042d44cb876fc72148bbc708dffb52129da"}}}
