{
  "applicability": {
    "exclusions": [],
    "predicates": [
      {
        "field": "candidate.stage",
        "op": "equals",
        "value": "replay_pending"
      }
    ]
  },
  "body": {
    "steps": [
      {
        "failure_action": "stop",
        "instruction": "Freeze fixture set refs and baseline mapping",
        "postconditions": [
          {
            "field": "replay.packet",
            "op": "equals",
            "value": "frozen"
          }
        ],
        "preconditions": [
          {
            "field": "candidate.stage",
            "op": "equals",
            "value": "replay_pending"
          }
        ],
        "step_id": "s1-freeze"
      },
      {
        "failure_action": "mark_inconclusive",
        "instruction": "Execute paired causal replay via the deterministic adapter",
        "postconditions": [
          {
            "field": "replay.result",
            "op": "equals",
            "value": "recorded"
          }
        ],
        "preconditions": [
          {
            "field": "replay.packet",
            "op": "equals",
            "value": "frozen"
          }
        ],
        "step_id": "s2-replay"
      }
    ]
  },
  "description": "Stable replay procedure",
  "kind": "human_procedure",
  "permissions": [
    {
      "capability": "memory_expand",
      "scope": "room-shared-space"
    }
  ],
  "schema_version": "gms.skill-artifact.v2",
  "title": "Run deterministic paired replay"
}
